{"bundle_id":"e82f214035e50e60720acadf3294e49820412918d4eed3eb1f6698f44fdcc637","export":{"checkpoint":{"duckdb":"ok","sqlite":[{"busy":0,"log":0,"path":"qfq_aux.db"},{"busy":0,"log":-1,"path":"qfq_aux_mcp_gen1.db"}]},"copy_bytes_total":74409730048,"copy_sha256_pass":true,"duration_sec":237.328,"lock_acquired_at":"2026-10-31T17:52:37+08:00","lock_task_id":"delivery_export"},"files":[{"bytes":62766198784,"kind":"duckdb","path":"quantstudio.db","sha256":"18bf43e543c11db34bd1f604f67d8e94fdc94cc62d8ad9fcb7ce2c72e962ca79","sqlite_header":null},{"bytes":11643478016,"kind":"sqlite","path":"qfq_aux.db","sha256":"bf497691fb2cc61e5546b3f188da6c099bbda8d04669283e7d1490443278f816","sqlite_header":"SQLite format 3"},{"bytes":53248,"kind":"sqlite","path":"qfq_aux_mcp_gen1.db","sha256":"8f546c10e1734affe3b11fe26ee303b56c25f5c40ae91712c7cdc365702295f7","sqlite_header":"SQLite format 3"}],"generated_at":"2026-10-31T17:56:33+08:00","main_db":{"path":"quantstudio.db","schema_status":"complete_2_2"},"manifest_schema_version":1,"producer":{"app":"QuantStudio","duckdb":"1.4.5","platform":"win32-nt","python":"3.11.9","sqlite":"3.45.1","version":"0.3.2+mvp"},"qfq":{"aux_paths_config_sha256":"73095cafb09d35343d34c49d4e08a8f5fe48805c1195ef140dc8cee6df1658f8","aux_route_step6_expect":{"gen1":"qfq_aux_mcp_gen1.db","legacy":"qfq_aux.db"},"qfq_active_cutover":{"cutover_id":"b6_formal_20260807_v2","price_source":"mcp","source_generation":"mcp-gen1"},"released":false},"row_count_degraded":false,"row_count_degraded_tables":[],"self_check":{"db_open":[{"path":"quantstudio.db","select1":"ok"},{"path":"qfq_aux.db","select1":"ok"},{"path":"qfq_aux_mcp_gen1.db","select1":"ok"}],"red_line":{"env_hits":0,"log_hits":0,"outside_files":[],"outside_whitelist":0,"shm_hits":0,"zero_leak":true},"wal_zero":[{"bytes":0,"path":"quantstudio.db-wal","present":false},{"bytes":0,"path":"qfq_aux.db-wal","present":false},{"bytes":0,"path":"qfq_aux_mcp_gen1.db-wal","present":false}]},"table_set":{"count":71,"empty_count":0,"out_of_map":["ai_research_snapshot","balance_statement","block_trade","broker_recommend","cashflow_statement","etf_basic","etf_daily","etf_dividend","etf_minutes","etf_minutes","fin_indicator","income_statement","index_constituents","index_daily","stock_daily","stock_daily_valuation","stock_dividend","stock_float_share","stock_minutes","stock_minutes","stock_namechange","stock_namechange","trade_calendar","xueqiu_sentiment"],"rule":"(应推进水位的表 ∪ questdb_table_map 覆盖的表) ∩ 库内实际存在","state_counts":{"BEHIND":6,"NO-WATERMARK-SYSTEM":50,"OK":10,"UNKNOWN-BASIS":5},"unknown_basis":["ai_research_snapshot","block_trade","broker_recommend","etf_basic","xueqiu_sentiment"]},"tables":[{"basis_source":"questdb_table_map.json","date_basis_col":"publish_date","freq":"daily","max_date":null,"row_count":557602,"row_count_method":"exact","source":"questdb","state":"NO-WATERMARK-SYSTEM","table":"cninfo_first_rating","watermark_last_date":null},{"basis_source":"questdb_table_map.json","date_basis_col":"event_time","freq":"daily","max_date":null,"row_count":104826,"row_count_method":"exact","source":"questdb","state":"NO-WATERMARK-SYSTEM","table":"cnthesims_events","watermark_last_date":null},{"basis_source":"questdb_table_map.json","date_basis_col":"trade_date","freq":"daily","max_date":null,"row_count":69153,"row_count_method":"exact","source":"questdb","state":"NO-WATERMARK-SYSTEM","table":"cnthesims_factors","watermark_last_date":null},{"basis_source":"questdb_table_map.json","date_basis_col":"trade_date","freq":"daily","max_date":null,"row_count":8133,"row_count_method":"exact","source":"questdb","state":"NO-WATERMARK-SYSTEM","table":"daily_info","watermark_last_date":null},{"basis_source":"questdb_table_map.json","date_basis_col":"publish_date","freq":"daily","max_date":null,"row_count":9160,"row_count_method":"exact","source":"questdb","state":"NO-WATERMARK-SYSTEM","table":"em_first_cover_rating","watermark_last_date":null},{"basis_source":"questdb_table_map.json","date_basis_col":"trade_date","freq":"daily","max_date":null,"row_count":365,"row_count_method":"exact","source":"questdb","state":"NO-WATERMARK-SYSTEM","table":"etf_sentiment_daily","watermark_last_date":null},{"basis_source":"questdb_table_map.json","date_basis_col":"datetime","freq":"daily","max_date":null,"row_count":5740,"row_count_method":"exact","source":"questdb","state":"NO-WATERMARK-SYSTEM","table":"factor_value","watermark_last_date":null},{"basis_source":"questdb_table_map.json","date_basis_col":"ann_date","freq":"daily","max_date":null,"row_count":66991,"row_count_method":"exact","source":"questdb","state":"NO-WATERMARK-SYSTEM","table":"forecast_vip","watermark_last_date":null},{"basis_source":"questdb_table_map.json","date_basis_col":"trade_date","freq":"daily","max_date":null,"row_count":134,"row_count_method":"exact","source":"questdb","state":"NO-WATERMARK-SYSTEM","table":"gisisi_daily","watermark_last_date":null},{"basis_source":"questdb_table_map.json","date_basis_col":"trade_date","freq":"daily","max_date":null,"row_count":36350,"row_count_method":"exact","source":"questdb","state":"NO-WATERMARK-SYSTEM","table":"hm_detail","watermark_last_date":null},{"basis_source":"questdb_table_map.json","date_basis_col":"ingest_time","freq":"daily","max_date":null,"row_count":9695,"row_count_method":"exact","source":"questdb","state":"NO-WATERMARK-SYSTEM","table":"hm_list","watermark_last_date":null},{"basis_source":"questdb_table_map.json","date_basis_col":"ann_date","freq":"daily","max_date":null,"row_count":1107,"row_count_method":"exact","source":"questdb","state":"NO-WATERMARK-SYSTEM","table":"idx_anns","watermark_last_date":null},{"basis_source":"questdb_table_map.json","date_basis_col":"ingest_time","freq":"daily","max_date":null,"row_count":7943,"row_count_method":"exact","source":"questdb","state":"NO-WATERMARK-SYSTEM","table":"index_classify","watermark_last_date":null},{"basis_source":"questdb_table_map.json","date_basis_col":"surv_date","freq":"daily","max_date":null,"row_count":113292,"row_count_method":"exact","source":"questdb","state":"NO-WATERMARK-SYSTEM","table":"inst_survey","watermark_last_date":null},{"basis_source":"questdb_table_map.json","date_basis_col":"trade_date","freq":"daily","max_date":null,"row_count":13695,"row_count_method":"exact","source":"questdb","state":"NO-WATERMARK-SYSTEM","table":"limit_cpt_list","watermark_last_date":null},{"basis_source":"questdb_table_map.json","date_basis_col":"trade_date","freq":"daily","max_date":null,"row_count":79631,"row_count_method":"exact","source":"questdb","state":"NO-WATERMARK-SYSTEM","table":"limit_list_d","watermark_last_date":null},{"basis_source":"questdb_table_map.json","date_basis_col":"trade_date","freq":"daily","max_date":null,"row_count":54346,"row_count_method":"exact","source":"questdb","state":"NO-WATERMARK-SYSTEM","table":"limit_list_ths","watermark_last_date":null},{"basis_source":"questdb_table_map.json","date_basis_col":"trade_date","freq":"daily","max_date":null,"row_count":13685,"row_count_method":"exact","source":"questdb","state":"NO-WATERMARK-SYSTEM","table":"limit_step","watermark_last_date":null},{"basis_source":"questdb_table_map.json","date_basis_col":"publish_time","freq":"daily","max_date":null,"row_count":45940,"row_count_method":"exact","source":"questdb","state":"NO-WATERMARK-SYSTEM","table":"llm_text_events","watermark_last_date":null},{"basis_source":"questdb_table_map.json","date_basis_col":"publish_time","freq":"daily","max_date":null,"row_count":45940,"row_count_method":"exact","source":"questdb","state":"NO-WATERMARK-SYSTEM","table":"llm_text_events_enriched","watermark_last_date":null},{"basis_source":"questdb_table_map.json","date_basis_col":"publish_time","freq":"daily","max_date":null,"row_count":45940,"row_count_method":"exact","source":"questdb","state":"NO-WATERMARK-SYSTEM","table":"llm_text_raw_feed","watermark_last_date":null},{"basis_source":"questdb_table_map.json","date_basis_col":"trade_date","freq":"daily","max_date":null,"row_count":2030,"row_count_method":"exact","source":"questdb","state":"NO-WATERMARK-SYSTEM","table":"margin","watermark_last_date":null},{"basis_source":"questdb_table_map.json","date_basis_col":"trade_date","freq":"daily","max_date":null,"row_count":683,"row_count_method":"exact","source":"questdb","state":"NO-WATERMARK-SYSTEM","table":"market_breadth_daily","watermark_last_date":null},{"basis_source":"questdb_table_map.json","date_basis_col":"trade_date","freq":"daily","max_date":null,"row_count":198982,"row_count_method":"exact","source":"questdb","state":"NO-WATERMARK-SYSTEM","table":"moneyflow_cnt_ths","watermark_last_date":null},{"basis_source":"questdb_table_map.json","date_basis_col":"trade_date","freq":"daily","max_date":null,"row_count":46170,"row_count_method":"exact","source":"questdb","state":"NO-WATERMARK-SYSTEM","table":"moneyflow_ind_ths","watermark_last_date":null},{"basis_source":"questdb_table_map.json","date_basis_col":"trade_date","freq":"daily","max_date":null,"row_count":155266,"row_count_method":"exact","source":"questdb","state":"NO-WATERMARK-SYSTEM","table":"news_sentiment","watermark_last_date":null},{"basis_source":"questdb_table_map.json","date_basis_col":"fetched_at","freq":"daily","max_date":null,"row_count":25659,"row_count_method":"exact","source":"questdb","state":"NO-WATERMARK-SYSTEM","table":"rsshub_raw","watermark_last_date":null},{"basis_source":"questdb_table_map.json","date_basis_col":"trade_date","freq":"daily","max_date":null,"row_count":24900,"row_count_method":"exact","source":"questdb","state":"NO-WATERMARK-SYSTEM","table":"sector_top300_daily","watermark_last_date":null},{"basis_source":"questdb_table_map.json","date_basis_col":"trade_date","freq":"daily","max_date":null,"row_count":9452,"row_count_method":"exact","source":"questdb","state":"NO-WATERMARK-SYSTEM","table":"sentiment_factor_daily","watermark_last_date":null},{"basis_source":"questdb_table_map.json","date_basis_col":"trade_date","freq":"daily","max_